{
  "schema_version": "1.0.0",
  "contract_type": "TradeProposal",
  "workflow_id": "wf_01",
  "correlation_id": "corr_01",
  "causation_id": "evt_02",
  "timestamp_utc": "2026-04-08T10:18:00Z",
  "originator": {
    "type": "agent",
    "id": "strategy_agent_v1"
  },
  "environment": "paper",
  "operating_mode": "MODE-001",
  "payload": {
    "proposal_id": "prop_01",
    "source_hypothesis_id": "hyp_01",
    "symbol": "EURUSD",
    "direction": "buy",
    "candidate_price_logic": {
      "type": "limit_retest",
      "reference": "prior_breakout_zone"
    },
    "proposed_size": {
      "volume_lots": 0.25
    },
    "operating_envelope": {
      "max_spread_pips": 1.5,
      "min_liquidity_score": 0.7
    },
    "session_restrictions": {
      "allowed_sessions": ["london", "new_york_overlap"]
    },
    "expiry_at": "2026-04-08T12:00:00Z",
    "transformation_version": "proposal_v1",
    "readiness_state": "ready_for_risk"
  }
}
